<!ELEMENT party (gast)*>
<!ATTLIST party datum CDATA #REQUIRED>
<!ELEMENT gast (getraenk*, zustand?)>
<!ATTLIST gast name CDATA #REQUIRED>
<!ELEMENT getraenk (#PCDATA)>
<!ELEMENT zustand EMPTY>
<!ATTLIST zustand ledig CDATA #IMPLIED nuechtern CDATA #IMPLIED>
