<?xml version="1.0" ?>
<!DOCTYPE party SYSTEM "party.dtd">
<party datum="31.12.01">
    <guest name="Albert Angsthase">
        <getraenk>Wein</getraenk>
        <getraenk>Bier</getraenk>
        <zustand ledig="true" nuechtern="false"/>
    </guest>
    <gast name="Martina Mutig">
        <getraenk>Apfelsaft</getraenk>
        <zustand ledig="true" nuechtern="true"/>

    </gast>
    <gast name="Zacharias Zottelig"></gast>
</party>
